anecdotes,fichier,anecdotes_reco,boucle_tâche.thisRepN,boucle_tâche.thisTrialN,boucle_tâche.thisN,boucle_tâche.thisIndex,boucle_reco.thisRepN,boucle_reco.thisTrialN,boucle_reco.thisN,boucle_reco.thisIndex,textWelcome.started,textWelcome.stopped,Instructions.started,key_resp.started,key_resp.keys,key_resp.rt,Anecdotes.started,tache_text.started,Validation_button.started,mouse_click.started,tache_text.text,mouse_click.x,mouse_click.y,mouse_click.leftButton,mouse_click.midButton,mouse_click.rightButton,mouse_click.time,mouse_click.clicked_name,feedbacktext.started,feedback_fichier_train.started,feedbacktext.stopped,feedback_fichier_train.stopped,text.started,text.stopped,waiting_screen.started,key_resp_2.started,key_resp_2.keys,key_resp_2.rt,blank.started,blank.stopped,text_3.started,key_resp_3.started,key_resp_3.keys,key_resp_3.rt,Anecdotes_reco.started,reco_text.started,validation_reco.started,mouse_reco.started,reco_text.text,mouse_reco.x,mouse_reco.y,mouse_reco.leftButton,mouse_reco.midButton,mouse_reco.rightButton,mouse_reco.time,mouse_reco.clicked_name,text_2.started,end.started,end.keys,end.rt,participant,session,date,expName,psychopyVersion,frameRate,
,,,,,,,,,,,55.01931920001516,57.021807100012666,57.021807100012666,60.021345300017856,space,18.949906399997417,,,,,,,,,,,,,,,,,,,,,,,,,,,,,,,,,,,,,,,,,,,,,LD8,002,2023-03-20_10h54.29.543,Expérimentation1_SOLO,2022.2.5,60.02217219852762,
L’océan Atlantique est plus salé que l’océan Pacifique,NOMS,L’océan Atlantique est plus salé que l’océan Pacifique,0,0,0,14,,,,,,,,,,,79.002232800005,79.002232800005,79.002232800005,0.01359370001591742, L'océan Atlantique est plus salé que l'océan Pacifique,[-0.004629629629629629],[-0.4],[1],[0],[0],[21.98273690001224],['Validation_button'],100.98420490001445,100.98420490001445,105.98403069999767,105.98403069999767,105.98403069999767,106.48395090000122,,,,,,,,,,,,,,,,,,,,,,,,,,,LD8,002,2023-03-20_10h54.29.543,Expérimentation1_SOLO,2022.2.5,60.02217219852762,
Les frites sont originaires de France et non de Belgique,INFOS,Les frites sont originaires de France et non de Belgique,0,1,1,12,,,,,,,,,,,106.48395090000122,106.48395090000122,106.48395090000122,0.0024554999836254865,Les frites sont originaires de Franec et non de Belgique,[-0.004629629629629629],[-0.4],[1],[0],[0],[17.829022199992323],['Validation_button'],124.31717730002129,124.31717730002129,129.31707050002296,129.31707050002296,129.31707050002296,129.81718130002264,,,,,,,,,,,,,,,,,,,,,,,,,,,LD8,002,2023-03-20_10h54.29.543,Expérimentation1_SOLO,2022.2.5,60.02217219852762,
La plus longue composition classique prendrait 639 ans à être interprétée. ,POINTS,La plus longue composition classique prendrait 639 ans à être interprétée. ,0,2,2,25,,,,,,,,,,,129.81718130002264,129.81718130002264,129.81718130002264,0.0062766000046394765,La plus longue composition classique prendrait 639 ans à etre interprétée,[0.000925925925925926],[-0.39537037037037037],[1],[0],[0],[32.67565160000231],['Validation_button'],162.4998895000026,162.4998895000026,167.50003900000593,167.50003900000593,167.50003900000593,167.99985970000853,,,,,,,,,,,,,,,,,,,,,,,,,,,LD8,002,2023-03-20_10h54.29.543,Expérimentation1_SOLO,2022.2.5,60.02217219852762,
La pyramide de Gizé est la seule des 7 merveilles de l’ancien monde qui existe toujours.,ITEMS,La pyramide de Gizé est la seule des 7 merveilles de l’ancien monde qui existe toujours.,0,3,3,22,,,,,,,,,,,167.99985970000853,167.99985970000853,167.99985970000853,0.0076698000193573534,La pyramide de Gizé est la seule des 7 merveilles de l'ancien monde qui existe toujours,[0.005555555555555556],[-0.40185185185185185],[1],[0],[0],[24.74169559997972],['Validation_button'],192.74967079999624,192.74967079999624,197.74958870001137,197.74958870001137,197.74958870001137,198.26623360000667,,,,,,,,,,,,,,,,,,,,,,,,,,,LD8,002,2023-03-20_10h54.29.543,Expérimentation1_SOLO,2022.2.5,60.02217219852762,
Une personne perdra environ 18 kilos de peau durant toute sa vie. ,POINTS,Une personne perdra environ 18 kilos de peau durant toute sa vie. ,0,4,4,26,,,,,,,,,,,198.26623360000667,198.26623360000667,198.26623360000667,0.012576100009027869,Une personnes perdra environs 18 kilos de peau durant toute sa vie,[0.002777777777777778],[-0.4],[1],[0],[0],[23.102753399987705],['Validation_button'],221.36618850001832,221.36618850001832,226.36585570001625,226.36585570001625,226.36585570001625,226.86624480001046,,,,,,,,,,,,,,,,,,,,,,,,,,,LD8,002,2023-03-20_10h54.29.543,Expérimentation1_SOLO,2022.2.5,60.02217219852762,
La Corée du Nord a annoncé avoir conduit un test nucléaire avec succès en octobre 2006. ,ITEMS,La Corée du Nord a annoncé avoir conduit un test nucléaire avec succès en octobre 2006. ,0,5,5,23,,,,,,,,,,,226.86624480001046,226.86624480001046,226.86624480001046,0.00512629997683689,La Corée du Nord à annoncé avoir conduit un test nucléaire avec succès en octibre 2006,[-0.000925925925925926],[-0.4027777777777778],[1],[0],[0],[27.960535999998683],['Validation_button'],254.83259960002033,254.83259960002033,259.8322423000063,259.8322423000063,259.8322423000063,260.33223400000134,,,,,,,,,,,,,,,,,,,,,,,,,,,LD8,002,2023-03-20_10h54.29.543,Expérimentation1_SOLO,2022.2.5,60.02217219852762,
L’Himalaya continue de grandir en raison des collisions des plaques tectoniques.,ITEMS,L’Himalaya continue de grandir en raison des collisions des plaques tectoniques.,0,6,6,21,,,,,,,,,,,260.33223400000134,260.33223400000134,260.33223400000134,0.005439400003524497,L'Himalaya continue de grandir en raison des collisionsdes plaques techtoniques,[-0.014814814814814815],[-0.4064814814814815],[1],[0],[0],[22.959547599981306],['Validation_button'],283.29872420002357,283.29872420002357,288.29852810001466,288.29852810001466,288.29852810001466,288.79868210002314,,,,,,,,,,,,,,,,,,,,,,,,,,,LD8,002,2023-03-20_10h54.29.543,Expérimentation1_SOLO,2022.2.5,60.02217219852762,
Les ongles incarnés sont héréditaires ,DONNEES,Les ongles incarnés sont héréditaires ,0,7,7,7,,,,,,,,,,,288.79868210002314,288.79868210002314,288.79868210002314,0.002882800006773323,Les ongles incarnés sont héréditaires,[-0.002777777777777778],[-0.40185185185185185],[1],[0],[0],[12.096348899998702],['Validation_button'],300.89843380000093,300.89843380000093,305.89833910000743,305.89833910000743,305.89833910000743,306.39846009999746,,,,,,,,,,,,,,,,,,,,,,,,,,,LD8,002,2023-03-20_10h54.29.543,Expérimentation1_SOLO,2022.2.5,60.02217219852762,
Le cœur d’une crevette est dans sa tête. ,POINTS,Le cœur d’une crevette est dans sa tête. ,0,8,8,28,,,,,,,,,,,306.39846009999746,306.39846009999746,306.39846009999746,0.0034189000143669546,Le coeur d'une crevette est dans sa tete,[0.012037037037037037],[-0.39537037037037037],[1],[0],[0],[11.345222100004321],['Validation_button'],317.74811790001695,317.74811790001695,322.74839660001453,322.74839660001453,322.74839660001453,323.2481754000182,,,,,,,,,,,,,,,,,,,,,,,,,,,LD8,002,2023-03-20_10h54.29.543,Expérimentation1_SOLO,2022.2.5,60.02217219852762,
L’œil d’une autruche est plus gros que son cerveau. ,ITEMS,L’œil d’une autruche est plus gros que son cerveau. ,0,9,9,19,,,,,,,,,,,323.2481754000182,323.2481754000182,323.2481754000182,0.0033890999911818653,L'oeil d'une autruche est plus gros que son cerveau.,[0.0],[-0.3990740740740741],[1],[0],[0],[19.312119200010784],['Validation_button'],342.5648707000073,342.5648707000073,347.56457330001285,347.56457330001285,347.56457330001285,348.06458800000837,,,,,,,,,,,,,,,,,,,,,,,,,,,LD8,002,2023-03-20_10h54.29.543,Expérimentation1_SOLO,2022.2.5,60.02217219852762,
Une personne brule plus de calories quand il dort que lorsqu’il regarde la télé. ,ITEMS,Une personne brule plus de calories quand il dort que lorsqu’il regarde la télé. ,0,10,10,20,,,,,,,,,,,348.06458800000837,348.06458800000837,348.06458800000837,0.004588799987686798,Une personne brule plus de calories quand il dort que lorsqu'il regarde la télé,[-0.005555555555555556],[-0.3990740740740741],[1],[0],[0],[29.177574600005755],['Validation_button'],377.2475889000052,377.2475889000052,382.24740770002245,382.24740770002245,382.24740770002245,382.7474448000139,,,,,,,,,,,,,,,,,,,,,,,,,,,LD8,002,2023-03-20_10h54.29.543,Expérimentation1_SOLO,2022.2.5,60.02217219852762,
Le Groenland est l’île la plus grande du monde par sa superficie. ,FAITS,Le Groenland est l’île la plus grande du monde par sa superficie. ,0,11,11,0,,,,,,,,,,,382.7474448000139,382.7474448000139,382.7474448000139,0.00467150000622496,Le Groeland est l'ile la plus grande du monde par sa surperficie,[0.002777777777777778],[-0.4],[1],[0],[0],[28.31049709999934],['Validation_button'],411.06410450002295,411.06410450002295,416.0640911000082,416.0640911000082,416.0640911000082,416.56380150001496,,,,,,,,,,,,,,,,,,,,,,,,,,,LD8,002,2023-03-20_10h54.29.543,Expérimentation1_SOLO,2022.2.5,60.02217219852762,
Une vache produit environ 200 000 bouteilles de lait dans sa vie. ,FAITS,Une vache produit environ 200 000 bouteilles de lait dans sa vie. ,0,12,12,2,,,,,,,,,,,416.56380150001496,416.56380150001496,416.56380150001496,0.00345509999897331,Une vache produit environ 200 000 bouteille de lait dans sa vie,[-0.005555555555555556],[-0.4074074074074074],[1],[0],[0],[27.261375899979612],['Validation_button'],443.8301764000207,443.8301764000207,448.8302740000072,448.8302740000072,448.8302740000072,449.33007850000286,,,,,,,,,,,,,,,,,,,,,,,,,,,LD8,002,2023-03-20_10h54.29.543,Expérimentation1_SOLO,2022.2.5,60.02217219852762,
La raie manta peut atteindre 9 mètres de long pour environ 2 tonnes.,INFOS,La raie manta peut atteindre 9 mètres de long pour environ 2 tonnes.,0,13,13,31,,,,,,,,,,,449.33007850000286,449.33007850000286,449.33007850000286,0.004133300011744723,La raie manta peut atteindre 9 mètres de long pour environ 2 tonnes,[0.001851851851851852],[-0.40555555555555556],[1],[0],[0],[22.7449639000115],['Validation_button'],472.0801281000022,472.0801281000022,477.0798018000205,477.0798018000205,477.0798018000205,477.5798895000189,,,,,,,,,,,,,,,,,,,,,,,,,,,LD8,002,2023-03-20_10h54.29.543,Expérimentation1_SOLO,2022.2.5,60.02217219852762,
On peut reproduire une clé grâce au son qu’elle émet lorsqu’on l’insère dans une serrure.,POINTS,On peut reproduire une clé grâce au son qu’elle émet lorsqu’on l’insère dans une serrure.,0,14,14,29,,,,,,,,,,,477.5798895000189,477.5798895000189,477.5798895000189,0.004435699986061081,On peut reproduire une clé grace au son qu'elle émet lorsqu'on l'insère dans une serrure,[-0.004629629629629629],[-0.3925925925925926],[1],[0],[0],[23.644160099996952],['Validation_button'],501.2297499999986,501.2297499999986,506.2296136000077,506.2296136000077,506.2296136000077,506.7295645000122,,,,,,,,,,,,,,,,,,,,,,,,,,,LD8,002,2023-03-20_10h54.29.543,Expérimentation1_SOLO,2022.2.5,60.02217219852762,
Les concerts Live 8 ont pris place dans les pays du G8 et en Afrique du Sud en juillet 2005.,NOMS,Les concerts Live 8 ont pris place dans les pays du G8 et en Afrique du Sud en juillet 2005.,0,15,15,16,,,,,,,,,,,506.7295645000122,506.7295645000122,506.7295645000122,0.006011400022543967,Les concerts Live 8 ont pris place dans les pays du G8 et en Arique du Sud en juillet 2005,[0.001851851851851852],[-0.4009259259259259],[1],[0],[0],[43.49228470001253],['Validation_button'],550.2292451999965,550.2292451999965,555.228883600008,555.228883600008,555.228883600008,555.7289849000226,,,,,,,,,,,,,,,,,,,,,,,,,,,LD8,002,2023-03-20_10h54.29.543,Expérimentation1_SOLO,2022.2.5,60.02217219852762,
Il y a en moyenne 178 graines de sésames sur le pain du Big Mac de McDonald. ,NOMS,Il y a en moyenne 178 graines de sésames sur le pain du Big Mac de McDonald. ,0,16,16,17,,,,,,,,,,,555.7289849000226,555.7289849000226,555.7289849000226,0.004003399983048439,Il y a en moyenne 178 graines de sésames sur le pain du Big Mac de MacDonald,[0.0],[-0.4009259259259259],[1],[0],[0],[29.344590900000185],['Validation_button'],585.0787514999975,585.0787514999975,590.0784337000223,590.0784337000223,590.0784337000223,590.5785941000213,,,,,,,,,,,,,,,,,,,,,,,,,,,LD8,002,2023-03-20_10h54.29.543,Expérimentation1_SOLO,2022.2.5,60.02217219852762,
"Seulement 2 pays touchent 3 océans, les Etats-Unis et le Canada",FAITS,"Seulement 2 pays touchent 3 océans, les Etats-Unis et le Canada",0,17,17,4,,,,,,,,,,,590.5785941000213,590.5785941000213,590.5785941000213,0.004441099998075515,"Seulement 2 pays touchent 3 océans, les Etats-Unis et le Canada",[0.003703703703703704],[-0.4027777777777778],[1],[0],[0],[25.843886400019983],['Validation_button'],616.4282124000019,616.4282124000019,621.4284837000014,621.4284837000014,621.4284837000014,621.9281079000211,,,,,,,,,,,,,,,,,,,,,,,,,,,LD8,002,2023-03-20_10h54.29.543,Expérimentation1_SOLO,2022.2.5,60.02217219852762,
La cacahuète est l’un des ingrédients de la dynamite. ,POINTS,La cacahuète est l’un des ingrédients de la dynamite. ,0,18,18,27,,,,,,,,,,,621.9281079000211,621.9281079000211,621.9281079000211,0.0036048000038135797,La cacahuète est l'un des ingédient de la dynamite,"[0.36018518518518516, 0.01574074074074074]","[-0.07962962962962963, -0.40185185185185185]","[1, 1]","[0, 0]","[0, 0]","[17.495160399994347, 20.22820449998835]",['Validation_button'],642.16130170002,642.16130170002,647.1612960000057,647.1612960000057,647.1612960000057,647.6610743000056,,,,,,,,,,,,,,,,,,,,,,,,,,,LD8,002,2023-03-20_10h54.29.543,Expérimentation1_SOLO,2022.2.5,60.02217219852762,
"Tout comme l’empreinte digitale, le cœur est propre à chaque individu et on peut l’identifier grâce à sa signature cardiaque.",NOMS,"Tout comme l’empreinte digitale, le cœur est propre à chaque individu et on peut l’identifier grâce à sa signature cardiaque.",0,19,19,30,,,,,,,,,,,647.6610743000056,647.6610743000056,647.6610743000056,0.005908899998757988,"Tout comme l'empreinte digitale, le coeur est propre à chaque individu et on peut l'identifier grace à sa signature cardiaque",[0.005555555555555556],[-0.3990740740740741],[1],[0],[0],[41.3095067999966],['Validation_button'],688.9775771000131,688.9775771000131,693.977409300016,693.977409300016,693.977409300016,694.4772052000044,,,,,,,,,,,,,,,,,,,,,,,,,,,LD8,002,2023-03-20_10h54.29.543,Expérimentation1_SOLO,2022.2.5,60.02217219852762,
Un attentat terroriste a eu lieu dans les métros Londonien en juillet 2005 ,DONNEES,Un attentat terroriste a eu lieu dans les métros Londonien en juillet 2005 ,0,20,20,5,,,,,,,,,,,694.4772052000044,694.4772052000044,694.4772052000044,0.002949699992313981,Un attentat terroriste a eu lieu dans les métros Londonien en juillet 2005,[0.002777777777777778],[-0.3990740740740741],[1],[0],[0],[24.89564530001371],['Validation_button'],719.3769749000203,719.3769749000203,724.3768526000204,724.3768526000204,724.3768526000204,724.8769549000135,,,,,,,,,,,,,,,,,,,,,,,,,,,LD8,002,2023-03-20_10h54.29.543,Expérimentation1_SOLO,2022.2.5,60.02217219852762,
Les séparatistes Tchéchènes du Sud de la Russie ont pris en otage une école en septembre 2004.,POINTS,Les séparatistes Tchéchènes du Sud de la Russie ont pris en otage une école en septembre 2004.,0,21,21,24,,,,,,,,,,,724.8769549000135,724.8769549000135,724.8769549000135,0.005226400011451915,Les séparatistes Tchéchènes du Sud de la Russie ont pris en otage une écoles en septembre 2004,[-0.005555555555555556],[-0.3925925925925926],[1],[0],[0],[30.559369499998866],['Validation_button'],755.4434551000013,755.4434551000013,760.4431942000228,760.4431942000228,760.4431942000228,760.9433409000048,,,,,,,,,,,,,,,,,,,,,,,,,,,LD8,002,2023-03-20_10h54.29.543,Expérimentation1_SOLO,2022.2.5,60.02217219852762,
L’Europe est le seul continent sans désert ,DONNEES,L’Europe est le seul continent sans désert ,0,22,22,8,,,,,,,,,,,760.9433409000048,760.9433409000048,760.9433409000048,0.0023925999994389713,L'europe est le seul continent sans désert,[-0.005555555555555556],[-0.39814814814814814],[1],[0],[0],[13.36246880001272],['Validation_button'],774.3097505000187,774.3097505000187,779.3095764000027,779.3095764000027,779.3095764000027,779.809585400013,,,,,,,,,,,,,,,,,,,,,,,,,,,LD8,002,2023-03-20_10h54.29.543,Expérimentation1_SOLO,2022.2.5,60.02217219852762,
La navette Spatiale Columbia s’est désintégrée durant son entrée dans l’atmosphère au-dessus du Texas en février 2003 ,DONNEES,La navette Spatiale Columbia s’est désintégrée durant son entrée dans l’atmosphère au-dessus du Texas en février 2003 ,0,23,23,9,,,,,,,,,,,779.809585400013,779.809585400013,779.809585400013,0.005954699998255819,La navette Spatial Columbia s'est désintégrée durant sont entrée dans l'atmosphère au-dessus du Texas en février 2003,[-0.002777777777777778],[-0.39537037037037037],[1],[0],[0],[35.975808100018185],['Validation_button'],815.792675100005,815.792675100005,820.792737300013,820.792737300013,820.792737300013,821.2927263000165,,,,,,,,,,,,,,,,,,,,,,,,,,,LD8,002,2023-03-20_10h54.29.543,Expérimentation1_SOLO,2022.2.5,60.02217219852762,
Les élastiques sont plus longs quand ils sont très froids/réfrigérés.,INFOS,Les élastiques sont plus longs quand ils sont très froids/réfrigérés.,0,24,24,11,,,,,,,,,,,821.2927263000165,821.2927263000165,821.2927263000165,0.005316299997502938,Les élastiques sont plus longs quand ils sont froids/réfrigérés,[-0.012962962962962963],[-0.3962962962962963],[1],[0],[0],[27.959683799999766],['Validation_button'],849.2588234000141,849.2588234000141,854.258839999995,854.258839999995,854.258839999995,854.7591049000039,,,,,,,,,,,,,,,,,,,,,,,,,,,LD8,002,2023-03-20_10h54.29.543,Expérimentation1_SOLO,2022.2.5,60.02217219852762,
Le tsunami dévastateur en Asie s’est produit en décembre 2004 ,FAITS,Le tsunami dévastateur en Asie s’est produit en décembre 2004 ,0,25,25,1,,,,,,,,,,,854.7591049000039,854.7591049000039,854.7591049000039,0.0031829999934416264,Le tsunami dévastateur en Asie s'est produit en décembre 2004,[0.001851851851851852],[-0.4027777777777778],[1],[0],[0],[22.76176019999548],['Validation_button'],877.5253330999985,877.5253330999985,882.5251422000001,882.5251422000001,882.5251422000001,883.0252370999951,,,,,,,,,,,,,,,,,,,,,,,,,,,LD8,002,2023-03-20_10h54.29.543,Expérimentation1_SOLO,2022.2.5,60.02217219852762,
La carte de visite d’Al Capone indiquait qu’il était vendeur de meuble d’occasion.,INFOS,La carte de visite d’Al Capone indiquait qu’il était vendeur de meuble d’occasion.,0,26,26,13,,,,,,,,,,,883.0252370999951,883.0252370999951,883.0252370999951,0.0038824000221211463,La carte de visite d'Al Caponne indiquait qu'il était vendeur de meubles d'occasion,[0.002777777777777778],[-0.3990740740740741],[1],[0],[0],[30.943742700008443],['Validation_button'],913.9750446999969,913.9750446999969,918.9749524000217,918.9749524000217,918.9749524000217,919.4747894000029,,,,,,,,,,,,,,,,,,,,,,,,,,,LD8,002,2023-03-20_10h54.29.543,Expérimentation1_SOLO,2022.2.5,60.02217219852762,
L’indicatif téléphonique international de l’Antarctique est 672 ,INFOS,L’indicatif téléphonique international de l’Antarctique est 672 ,0,27,27,10,,,,,,,,,,,919.4747894000029,919.4747894000029,919.4747894000029,0.004018700012238696,L'indicatif téléphonique international de l'Antarctique est 672,[-0.003703703703703704],[-0.39814814814814814],[1],[0],[0],[27.744142099982128],['Validation_button'],947.2246480000031,947.2246480000031,952.2244681000011,952.2244681000011,952.2244681000011,952.7244166000164,,,,,,,,,,,,,,,,,,,,,,,,,,,LD8,002,2023-03-20_10h54.29.543,Expérimentation1_SOLO,2022.2.5,60.02217219852762,
Il y a eu 25 présidents Français ,DONNEES,Il y a eu 25 présidents Français ,0,28,28,6,,,,,,,,,,,952.7244166000164,952.7244166000164,952.7244166000164,0.004506900004344061,Il y a eu 25 présients Français,[0.013888888888888888],[-0.39814814814814814],[1],[0],[0],[15.47699600001215],['Validation_button'],968.2075377000147,968.2075377000147,973.2075959000213,973.2075959000213,973.2075959000213,973.7074380000122,,,,,,,,,,,,,,,,,,,,,,,,,,,LD8,002,2023-03-20_10h54.29.543,Expérimentation1_SOLO,2022.2.5,60.02217219852762,
L’écriture chinoise comprend plus de 40 000 caractères. ,NOMS,L’écriture chinoise comprend plus de 40 000 caractères. ,0,29,29,18,,,,,,,,,,,973.7074380000122,973.7074380000122,973.7074380000122,0.003463700006250292,L'écriture chinoise comprends plus de 400 000 caractères,[-0.000925925925925926],[-0.39444444444444443],[1],[0],[0],[20.561513199994806],['Validation_button'],994.2739437000128,994.2739437000128,999.2739416999975,999.2739416999975,999.2739416999975,999.773772000015,,,,,,,,,,,,,,,,,,,,,,,,,,,LD8,002,2023-03-20_10h54.29.543,Expérimentation1_SOLO,2022.2.5,60.02217219852762,
Les oiseaux bleus ne peuvent pas voir la couleur bleue. ,FAITS,Les oiseaux bleus ne peuvent pas voir la couleur bleue. ,0,30,30,3,,,,,,,,,,,999.773772000015,999.773772000015,999.773772000015,0.0032278999860864133,Les oiseaux bleus dne peuvent pas voir la couleur bleue,[0.007407407407407408],[-0.38981481481481484],[1],[0],[0],[22.445333000010578],['Validation_button'],1022.2237888000091,1022.2237888000091,1027.2236061000149,1027.2236061000149,1027.2236061000149,1027.723527299997,,,,,,,,,,,,,,,,,,,,,,,,,,,LD8,002,2023-03-20_10h54.29.543,Expérimentation1_SOLO,2022.2.5,60.02217219852762,
La république dominicaine est le seul pays qui possède un drapeau contenant une bible.,NOMS,La république dominicaine est le seul pays qui possède un drapeau contenant une bible.,0,31,31,15,,,,,,,,,,,1027.723527299997,1027.723527299997,1027.723527299997,0.004431799985468388,La république dominicaine est le seul pays qui possède un drapeau contenant une bible,[0.001851851851851852],[-0.4046296296296296],[1],[0],[0],[30.77670729998499],['Validation_button'],1058.5064917000127,1058.5064917000127,1063.5065982000087,1063.5065982000087,1063.5065982000087,1064.0064429000195,,,,,,,,,,,,,,,,,,,,,,,,,,,LD8,002,2023-03-20_10h54.29.543,Expérimentation1_SOLO,2022.2.5,60.02217219852762,
,,,,,,,,,,,,,,,,,,,,,,,,,,,,,,,,,,,1064.0064429000195,1067.0064697000198,i,857.1710163000098,,,,,,,,,,,,,,,,,,,,,,,LD8,002,2023-03-20_10h54.29.543,Expérimentation1_SOLO,2022.2.5,60.02217219852762,
,,,,,,,,,,,,,,,,,,,,,,,,,,,,,,,,,,,,,,,1924.1970038000145,1924.696991100005,1924.696991100005,1927.6801811000041,space,7.855947000003653,,,,,,,,,,,,,,,,,LD8,002,2023-03-20_10h54.29.543,Expérimentation1_SOLO,2022.2.5,60.02217219852762,
Le Groenland est l’île la plus grande du monde par sa superficie. ,FAITS,Le Groenland est l’île la plus grande du monde par sa superficie. ,,,,,0,0,0,0,,,,,,,,,,,,,,,,,,,,,,,,,,,,,1944.9798308000027,1945.4799153000058,,,,,1936.0664315000176,1936.0664315000176,1936.0664315000176,0.012046399991959333,faits,[0.003703703703703704],[-0.3972222222222222],[1],[0],[0],[8.90410400001565],['validation_reco'],,,,,LD8,002,2023-03-20_10h54.29.543,Expérimentation1_SOLO,2022.2.5,60.02217219852762,
Une personne perdra environ 18 kilos de peau durant toute sa vie. ,POINTS,Une personne perdra environ 18 kilos de peau durant toute sa vie. ,,,,,0,1,1,26,,,,,,,,,,,,,,,,,,,,,,,,,,,,,1953.0131130000227,1953.5132572000148,,,,,1945.4799153000058,1945.4799153000058,1945.4799153000058,0.003204000007826835,données,[0.000925925925925926],[-0.40185185185185185],[1],[0],[0],[7.5288088000088464],['validation_reco'],,,,,LD8,002,2023-03-20_10h54.29.543,Expérimentation1_SOLO,2022.2.5,60.02217219852762,
L’océan Atlantique est plus salé que l’océan Pacifique,NOMS,L’océan Atlantique est plus salé que l’océan Pacifique,,,,,0,2,2,14,,,,,,,,,,,,,,,,,,,,,,,,,,,,,1960.3464555999963,1960.846326400002,,,,,1953.5132572000148,1953.5132572000148,1953.5132572000148,0.003787599998759106,FAits,[-0.001851851851851852],[-0.3925925925925926],[1],[0],[0],[6.8290518000139855],['validation_reco'],,,,,LD8,002,2023-03-20_10h54.29.543,Expérimentation1_SOLO,2022.2.5,60.02217219852762,
La plus longue composition classique prendrait 639 ans à être interprétée. ,POINTS,La plus longue composition classique prendrait 639 ans à être interprétée. ,,,,,0,3,3,25,,,,,,,,,,,,,,,,,,,,,,,,,,,,,1977.382614800008,1977.8827307000174,,,,,1960.846326400002,1960.846326400002,1960.846326400002,0.004266100004315376,noms,[-0.001851851851851852],[-0.39351851851851855],[1],[0],[0],[16.53144200000679],['validation_reco'],,,,,LD8,002,2023-03-20_10h54.29.543,Expérimentation1_SOLO,2022.2.5,60.02217219852762,
La carte de visite d’Al Capone indiquait qu’il était vendeur de meuble d’occasion.,INFOS,La carte de visite d’Al Capone indiquait qu’il était vendeur de meuble d’occasion.,,,,,0,4,4,13,,,,,,,,,,,,,,,,,,,,,,,,,,,,,1991.0152579999994,1991.5154187000007,,,,,1977.8827307000174,1977.8827307000174,1977.8827307000174,0.0040926999936345965,noms,[0.003703703703703704],[-0.39351851851851855],[1],[0],[0],[13.12763930001529],['validation_reco'],,,,,LD8,002,2023-03-20_10h54.29.543,Expérimentation1_SOLO,2022.2.5,60.02217219852762,
Les frites sont originaires de France et non de Belgique,INFOS,Les frites sont originaires de France et non de Belgique,,,,,0,5,5,12,,,,,,,,,,,,,,,,,,,,,,,,,,,,,1999.5656084000075,2000.065796400013,,,,,1991.5154187000007,1991.5154187000007,1991.5154187000007,0.00298689998453483,items,[0.003703703703703704],[-0.38981481481481484],[1],[0],[0],[8.046731500013266],['validation_reco'],,,,,LD8,002,2023-03-20_10h54.29.543,Expérimentation1_SOLO,2022.2.5,60.02217219852762,
"Seulement 2 pays touchent 3 océans, les Etats-Unis et le Canada",FAITS,"Seulement 2 pays touchent 3 océans, les Etats-Unis et le Canada",,,,,0,6,6,4,,,,,,,,,,,,,,,,,,,,,,,,,,,,,2009.148311900004,2009.6485157000134,,,,,2000.065796400013,2000.065796400013,2000.065796400013,0.0034360999998170882,faits,[0.0],[-0.40185185185185185],[1],[0],[0],[9.078530600003432],['validation_reco'],,,,,LD8,002,2023-03-20_10h54.29.543,Expérimentation1_SOLO,2022.2.5,60.02217219852762,
