"Tout comme l’empreinte digitale, le cœur est propre à chaque individu et on peut l’identifier grâce à sa signature cardiaque.",NOMS,"Tout comme l’empreinte digitale, le cœur est propre à chaque individu et on peut l’identifier grâce à sa signature cardiaque.",,,,,0,7,7,30,,,,,,,,,,,,,,,,,,,,,,,,,,,,,2019.8481434000132,2020.348335000017,,,,,2009.6485157000134,2009.6485157000134,2009.6485157000134,0.006206299993209541,items,[0.0],[-0.40185185185185185],[1],[0],[0],[10.192643999995198],['validation_reco'],,,,,LD8,002,2023-03-20_10h54.29.543,Expérimentation1_SOLO,2022.2.5,60.02217219852762,
L’Europe est le seul continent sans désert ,DONNEES,L’Europe est le seul continent sans désert ,,,,,0,8,8,8,,,,,,,,,,,,,,,,,,,,,,,,,,,,,2035.4289875999966,2035.929120900022,,,,,2020.348335000017,2020.348335000017,2020.348335000017,0.0033705000241752714,items,"[-0.004629629629629629, 0.0]","[-0.38796296296296295, -0.39537037037037037]","[1, 1]","[0, 0]","[0, 0]","[14.32891589999781, 15.077176699996926]",['validation_reco'],,,,,LD8,002,2023-03-20_10h54.29.543,Expérimentation1_SOLO,2022.2.5,60.02217219852762,
La navette Spatiale Columbia s’est désintégrée durant son entrée dans l’atmosphère au-dessus du Texas en février 2003 ,DONNEES,La navette Spatiale Columbia s’est désintégrée durant son entrée dans l’atmosphère au-dessus du Texas en février 2003 ,,,,,0,9,9,9,,,,,,,,,,,,,,,,,,,,,,,,,,,,,2046.7620442000043,2047.2621456000197,,,,,2035.929120900022,2035.929120900022,2035.929120900022,0.00531750000664033,faits,[0.000925925925925926],[-0.3962962962962963],[1],[0],[0],[10.826528500008862],['validation_reco'],,,,,LD8,002,2023-03-20_10h54.29.543,Expérimentation1_SOLO,2022.2.5,60.02217219852762,
Le tsunami dévastateur en Asie s’est produit en décembre 2004 ,FAITS,Le tsunami dévastateur en Asie s’est produit en décembre 2004 ,,,,,0,10,10,1,,,,,,,,,,,,,,,,,,,,,,,,,,,,,2054.5956331000198,2055.095560000016,,,,,2047.2621456000197,2047.2621456000197,2047.2621456000197,0.0036589999799616635,noms,[0.004629629629629629],[-0.3972222222222222],[1],[0],[0],[7.329024399979971],['validation_reco'],,,,,LD8,002,2023-03-20_10h54.29.543,Expérimentation1_SOLO,2022.2.5,60.02217219852762,
Il y a eu 25 présidents Français ,DONNEES,Il y a eu 25 présidents Français ,,,,,0,11,11,6,,,,,,,,,,,,,,,,,,,,,,,,,,,,,2064.695281799999,2065.195288100018,,,,,2055.095560000016,2055.095560000016,2055.095560000016,0.002719599986448884,données,[0.000925925925925926],[-0.3962962962962963],[1],[0],[0],[9.5962523999915],['validation_reco'],,,,,LD8,002,2023-03-20_10h54.29.543,Expérimentation1_SOLO,2022.2.5,60.02217219852762,
L’indicatif téléphonique international de l’Antarctique est 672 ,INFOS,L’indicatif téléphonique international de l’Antarctique est 672 ,,,,,0,12,12,10,,,,,,,,,,,,,,,,,,,,,,,,,,,,,2079.8118692999997,2080.3116521000047,,,,,2065.195288100018,2065.195288100018,2065.195288100018,0.003189999988535419,items,[-0.000925925925925926],[-0.39537037037037037],[1],[0],[0],[14.612387900007889],['validation_reco'],,,,,LD8,002,2023-03-20_10h54.29.543,Expérimentation1_SOLO,2022.2.5,60.02217219852762,
La raie manta peut atteindre 9 mètres de long pour environ 2 tonnes.,INFOS,La raie manta peut atteindre 9 mètres de long pour environ 2 tonnes.,,,,,0,13,13,31,,,,,,,,,,,,,,,,,,,,,,,,,,,,,2094.5950326000166,2095.0952722000075,,,,,2080.3116521000047,2080.3116521000047,2080.3116521000047,0.0036709000123664737,données,[-0.000925925925925926],[-0.39537037037037037],[1],[0],[0],[14.278797500010114],['validation_reco'],,,,,LD8,002,2023-03-20_10h54.29.543,Expérimentation1_SOLO,2022.2.5,60.02217219852762,
La république dominicaine est le seul pays qui possède un drapeau contenant une bible.,NOMS,La république dominicaine est le seul pays qui possède un drapeau contenant une bible.,,,,,0,14,14,15,,,,,,,,,,,,,,,,,,,,,,,,,,,,,2106.2613524000044,2106.7615978000103,,,,,2095.0952722000075,2095.0952722000075,2095.0952722000075,0.004226899996865541,faits,[-0.001851851851851852],[-0.39537037037037037],[1],[0],[0],[11.161456600006204],['validation_reco'],,,,,LD8,002,2023-03-20_10h54.29.543,Expérimentation1_SOLO,2022.2.5,60.02217219852762,
L’œil d’une autruche est plus gros que son cerveau. ,ITEMS,L’œil d’une autruche est plus gros que son cerveau. ,,,,,0,15,15,19,,,,,,,,,,,,,,,,,,,,,,,,,,,,,2111.5614043000096,2112.0615201000182,,,,,2106.7615978000103,2106.7615978000103,2106.7615978000103,0.0033093999954871833,items,[-0.001851851851851852],[-0.39444444444444443],[1],[0],[0],[4.795680799987167],['validation_reco'],,,,,LD8,002,2023-03-20_10h54.29.543,Expérimentation1_SOLO,2022.2.5,60.02217219852762,
Les séparatistes Tchéchènes du Sud de la Russie ont pris en otage une école en septembre 2004.,POINTS,Les séparatistes Tchéchènes du Sud de la Russie ont pris en otage une école en septembre 2004.,,,,,0,16,16,24,,,,,,,,,,,,,,,,,,,,,,,,,,,,,2127.8111669000064,2128.311070900003,,,,,2112.0615201000182,2112.0615201000182,2112.0615201000182,0.004956999997375533,noms,[-0.002777777777777778],[-0.39444444444444443],[1],[0],[0],[15.74412710001343],['validation_reco'],,,,,LD8,002,2023-03-20_10h54.29.543,Expérimentation1_SOLO,2022.2.5,60.02217219852762,
La pyramide de Gizé est la seule des 7 merveilles de l’ancien monde qui existe toujours.,ITEMS,La pyramide de Gizé est la seule des 7 merveilles de l’ancien monde qui existe toujours.,,,,,0,17,17,22,,,,,,,,,,,,,,,,,,,,,,,,,,,,,2143.7110284000228,2144.2111213000026,,,,,2128.311070900003,2128.311070900003,2128.311070900003,0.005081400013295934,noms,[-0.003703703703703704],[-0.39351851851851855],[1],[0],[0],[15.394252700003562],['validation_reco'],,,,,LD8,002,2023-03-20_10h54.29.543,Expérimentation1_SOLO,2022.2.5,60.02217219852762,
La Corée du Nord a annoncé avoir conduit un test nucléaire avec succès en octobre 2006. ,ITEMS,La Corée du Nord a annoncé avoir conduit un test nucléaire avec succès en octobre 2006. ,,,,,0,18,18,23,,,,,,,,,,,,,,,,,,,,,,,,,,,,,2156.6442424000124,2157.144169200008,,,,,2144.2111213000026,2144.2111213000026,2144.2111213000026,0.003978799999458715,données,[-0.002777777777777778],[-0.39351851851851855],[1],[0],[0],[12.428400999982841],['validation_reco'],,,,,LD8,002,2023-03-20_10h54.29.543,Expérimentation1_SOLO,2022.2.5,60.02217219852762,
L’Himalaya continue de grandir en raison des collisions des plaques tectoniques.,ITEMS,L’Himalaya continue de grandir en raison des collisions des plaques tectoniques.,,,,,0,19,19,21,,,,,,,,,,,,,,,,,,,,,,,,,,,,,2164.794088800001,2165.2941346000007,,,,,2157.144169200008,2157.144169200008,2157.144169200008,0.004134299990255386,noms,[-0.002777777777777778],[-0.39351851851851855],[1],[0],[0],[7.645145699993009],['validation_reco'],,,,,LD8,002,2023-03-20_10h54.29.543,Expérimentation1_SOLO,2022.2.5,60.02217219852762,
Les oiseaux bleus ne peuvent pas voir la couleur bleue. ,FAITS,Les oiseaux bleus ne peuvent pas voir la couleur bleue. ,,,,,0,20,20,3,,,,,,,,,,,,,,,,,,,,,,,,,,,,,2171.744100300013,2172.2439508000098,,,,,2165.2941346000007,2165.2941346000007,2165.2941346000007,0.003051299980143085,faits,[-0.003703703703703704],[-0.3925925925925926],[1],[0],[0],[6.445948399981717],['validation_reco'],,,,,LD8,002,2023-03-20_10h54.29.543,Expérimentation1_SOLO,2022.2.5,60.02217219852762,
L’écriture chinoise comprend plus de 40 000 caractères. ,NOMS,L’écriture chinoise comprend plus de 40 000 caractères. ,,,,,0,21,21,18,,,,,,,,,,,,,,,,,,,,,,,,,,,,,2187.0941486000083,2187.5938915000006,,,,,2172.2439508000098,2172.2439508000098,2172.2439508000098,0.0035010999999940395,items,[-0.008333333333333333],[-0.4],[1],[0],[0],[14.84550890000537],['validation_reco'],,,,,LD8,002,2023-03-20_10h54.29.543,Expérimentation1_SOLO,2022.2.5,60.02217219852762,
Le cœur d’une crevette est dans sa tête. ,POINTS,Le cœur d’une crevette est dans sa tête. ,,,,,0,22,22,28,,,,,,,,,,,,,,,,,,,,,,,,,,,,,2192.1272035000147,2192.627012800018,,,,,2187.5938915000006,2187.5938915000006,2187.5938915000006,0.0028781000000890344,items,[-0.009259259259259259],[-0.3990740740740741],[1],[0],[0],[4.529571500024758],['validation_reco'],,,,,LD8,002,2023-03-20_10h54.29.543,Expérimentation1_SOLO,2022.2.5,60.02217219852762,
On peut reproduire une clé grâce au son qu’elle émet lorsqu’on l’insère dans une serrure.,POINTS,On peut reproduire une clé grâce au son qu’elle émet lorsqu’on l’insère dans une serrure.,,,,,0,23,23,29,,,,,,,,,,,,,,,,,,,,,,,,,,,,,2206.4936418000143,2206.993816400005,,,,,2192.627012800018,2192.627012800018,2192.627012800018,0.004536799999186769,faits,[-0.009259259259259259],[-0.3990740740740741],[1],[0],[0],[13.861070200015092],['validation_reco'],,,,,LD8,002,2023-03-20_10h54.29.543,Expérimentation1_SOLO,2022.2.5,60.02217219852762,
Une vache produit environ 200 000 bouteilles de lait dans sa vie. ,FAITS,Une vache produit environ 200 000 bouteilles de lait dans sa vie. ,,,,,0,24,24,2,,,,,,,,,,,,,,,,,,,,,,,,,,,,,2213.993569300015,2214.493467000022,,,,,2206.993816400005,2206.993816400005,2206.993816400005,0.0037958000029902905,noms,[-0.009259259259259259],[-0.3990740740740741],[1],[0],[0],[6.995462699997006],['validation_reco'],,,,,LD8,002,2023-03-20_10h54.29.543,Expérimentation1_SOLO,2022.2.5,60.02217219852762,
Une personne brule plus de calories quand il dort que lorsqu’il regarde la télé. ,ITEMS,Une personne brule plus de calories quand il dort que lorsqu’il regarde la télé. ,,,,,0,25,25,20,,,,,,,,,,,,,,,,,,,,,,,,,,,,,2230.5102802000183,2231.0102644000144,,,,,2214.493467000022,2214.493467000022,2214.493467000022,0.004895499994745478,faits,[-0.009259259259259259],[-0.3990740740740741],[1],[0],[0],[16.010781200020574],['validation_reco'],,,,,LD8,002,2023-03-20_10h54.29.543,Expérimentation1_SOLO,2022.2.5,60.02217219852762,
La cacahuète est l’un des ingrédients de la dynamite. ,POINTS,La cacahuète est l’un des ingrédients de la dynamite. ,,,,,0,26,26,27,,,,,,,,,,,,,,,,,,,,,,,,,,,,,2238.14350570002,2238.6435474000173,,,,,2231.0102644000144,2231.0102644000144,2231.0102644000144,0.0036659000033978373,items,[0.016666666666666666],[-0.3990740740740741],[1],[0],[0],[7.1290011999954],['validation_reco'],,,,,LD8,002,2023-03-20_10h54.29.543,Expérimentation1_SOLO,2022.2.5,60.02217219852762,
Un attentat terroriste a eu lieu dans les métros Londonien en juillet 2005 ,DONNEES,Un attentat terroriste a eu lieu dans les métros Londonien en juillet 2005 ,,,,,0,27,27,5,,,,,,,,,,,,,,,,,,,,,,,,,,,,,2250.909771400009,2251.4098027000146,,,,,2238.6435474000173,2238.6435474000173,2238.6435474000173,0.0036610999959520996,données,[0.016666666666666666],[-0.3990740740740741],[1],[0],[0],[12.26178559998516],['validation_reco'],,,,,LD8,002,2023-03-20_10h54.29.543,Expérimentation1_SOLO,2022.2.5,60.02217219852762,
Il y a en moyenne 178 graines de sésames sur le pain du Big Mac de McDonald. ,NOMS,Il y a en moyenne 178 graines de sésames sur le pain du Big Mac de McDonald. ,,,,,0,28,28,17,,,,,,,,,,,,,,,,,,,,,,,,,,,,,2256.976410800009,2257.476318400004,,,,,2251.4098027000146,2251.4098027000146,2251.4098027000146,0.00471889998880215,noms,[0.017592592592592594],[-0.4064814814814815],[1],[0],[0],[5.56167940000887],['validation_reco'],,,,,LD8,002,2023-03-20_10h54.29.543,Expérimentation1_SOLO,2022.2.5,60.02217219852762,
Les ongles incarnés sont héréditaires ,DONNEES,Les ongles incarnés sont héréditaires ,,,,,0,29,29,7,,,,,,,,,,,,,,,,,,,,,,,,,,,,,2278.959774500021,2279.45971320002,,,,,2257.476318400004,2257.476318400004,2257.476318400004,0.0023597000108566135,données,[-0.001851851851851852],[-0.40370370370370373],[1],[0],[0],[21.479644399980316],['validation_reco'],,,,,LD8,002,2023-03-20_10h54.29.543,Expérimentation1_SOLO,2022.2.5,60.02217219852762,
Les élastiques sont plus longs quand ils sont très froids/réfrigérés.,INFOS,Les élastiques sont plus longs quand ils sont très froids/réfrigérés.,,,,,0,30,30,11,,,,,,,,,,,,,,,,,,,,,,,,,,,,,2290.7594047000166,2291.2593839000037,,,,,2279.45971320002,2279.45971320002,2279.45971320002,0.0044043999805580825,faits,[-0.005555555555555556],[-0.4027777777777778],[1],[0],[0],[11.294574700004887],['validation_reco'],,,,,LD8,002,2023-03-20_10h54.29.543,Expérimentation1_SOLO,2022.2.5,60.02217219852762,
Les concerts Live 8 ont pris place dans les pays du G8 et en Afrique du Sud en juillet 2005.,NOMS,Les concerts Live 8 ont pris place dans les pays du G8 et en Afrique du Sud en juillet 2005.,,,,,0,31,31,16,,,,,,,,,,,,,,,,,,,,,,,,,,,,,2307.709282900003,2308.209177200013,,,,,2291.2593839000037,2291.2593839000037,2291.2593839000037,0.005497699981788173,noms,[-0.014814814814814815],[-0.4074074074074074],[1],[0],[0],[16.443573199998355],['validation_reco'],,,,,LD8,002,2023-03-20_10h54.29.543,Expérimentation1_SOLO,2022.2.5,60.02217219852762,
,,,,,,,,,,,,,,,,,,,,,,,,,,,,,,,,,,,,,,,,,,,,,,,,,,,,,,,,,2308.209177200013,2308.209177200013,i,473.83025780000025,LD8,002,2023-03-20_10h54.29.543,Expérimentation1_SOLO,2022.2.5,60.02217219852762,
