anecdotes,fichier,anecdotes_reco,boucle_tâche.thisRepN,boucle_tâche.thisTrialN,boucle_tâche.thisN,boucle_tâche.thisIndex,boucle_reco.thisRepN,boucle_reco.thisTrialN,boucle_reco.thisN,boucle_reco.thisIndex,textWelcome.started,textWelcome.stopped,Instructions.started,key_resp.started,key_resp.keys,key_resp.rt,Anecdotes.started,tache_text.started,Validation_button.started,mouse_click.started,tache_text.text,mouse_click.x,mouse_click.y,mouse_click.leftButton,mouse_click.midButton,mouse_click.rightButton,mouse_click.time,mouse_click.clicked_name,feedbacktext.started,feedback_fichier_train.started,feedbacktext.stopped,feedback_fichier_train.stopped,text.started,text.stopped,waiting_screen.started,key_resp_2.started,key_resp_2.keys,key_resp_2.rt,blank.started,blank.stopped,text_3.started,key_resp_3.started,key_resp_3.keys,key_resp_3.rt,Anecdotes_reco.started,reco_text.started,validation_reco.started,mouse_reco.started,reco_text.text,mouse_reco.x,mouse_reco.y,mouse_reco.leftButton,mouse_reco.midButton,mouse_reco.rightButton,mouse_reco.time,mouse_reco.clicked_name,text_2.started,end.started,participant,session,date,expName,psychopyVersion,frameRate,
,,,,,,,,,,,34.41042360011488,36.410303300013766,36.410303300013766,39.41020560008474,space,21.75307559990324,,,,,,,,,,,,,,,,,,,,,,,,,,,,,,,,,,,,,,,,,,,AK4,001,2023-03-17_12h01.51.012,Expérimentation1_SOLO,2022.2.5,60.031720779161645,
La république dominicaine est le seul pays qui possède un drapeau contenant une bible ,NOMS,La république dominicaine est le seul pays qui possède un drapeau contenant une bible ,0,0,0,15,,,,,,,,,,,61.244139400077984,61.244139400077984,61.244139400077984,0.031407699920237064, La république dominicaine est le seul pays qui possède un drapeau contenant une bible,"[0.27870370370370373, 0.2833333333333333, 0.016666666666666666]","[-0.03518518518518519, -0.03888888888888889, -0.39537037037037037]","[1, 1, 1]","[0, 0, 0]","[0, 0, 0]","[19.235221199924126, 19.768557699862868, 35.30155019997619]",['Validation_button'],96.52652790001594,96.52652790001594,101.52648460003547,101.52648460003547,101.52648460003547,102.04290580004454,,,,,,,,,,,,,,,,,,,,,,,,,AK4,001,2023-03-17_12h01.51.012,Expérimentation1_SOLO,2022.2.5,60.031720779161645,
La navette Spatiale Columbia s’est désintégrée durant son entrée dans l’atmosphère au-dessus du Texas en février 2003 ,DONNEES,La navette Spatiale Columbia s’est désintégrée durant son entrée dans l’atmosphère au-dessus du Texas en février 2003 ,0,1,1,9,,,,,,,,,,,102.04290580004454,102.04290580004454,102.04290580004454,0.014436099911108613,La navette Spatiale Columnia s'est désintégrée durant son entrée dans l'atmosphère au-dessus du Texas en février 2003,[-0.000925925925925926],[-0.39814814814814814],[1],[0],[0],[23.634124499978498],['Validation_button'],125.67598830000497,125.67598830000497,130.67599450005218,130.67599450005218,130.67599450005218,131.17620260012336,,,,,,,,,,,,,,,,,,,,,,,,,AK4,001,2023-03-17_12h01.51.012,Expérimentation1_SOLO,2022.2.5,60.031720779161645,
Le Groenland est l’île la plus grande du monde par sa superficie  ,FAITS,Le Groenland est l’île la plus grande du monde par sa superficie  ,0,2,2,0,,,,,,,,,,,131.17620260012336,131.17620260012336,131.17620260012336,0.005107099888846278,Le Groenland est l'ile la plus grande du monde par sa superficie,[-0.012962962962962963],[-0.3907407407407407],[1],[0],[0],[11.46019889996387],['Validation_button'],142.64249500003643,142.64249500003643,147.64238640014082,147.64238640014082,147.64238640014082,148.14255270012654,,,,,,,,,,,,,,,,,,,,,,,,,AK4,001,2023-03-17_12h01.51.012,Expérimentation1_SOLO,2022.2.5,60.031720779161645,
Le cœur d’une crevette est dans sa tête  ,POINTS,Le cœur d’une crevette est dans sa tête  ,0,3,3,28,,,,,,,,,,,148.14255270012654,148.14255270012654,148.14255270012654,0.003856699913740158,Le coeur d'une crevette est dans sa tete,[0.000925925925925926],[-0.3907407407407407],[1],[0],[0],[7.67887909989804],['Validation_button'],155.8258040000219,155.8258040000219,160.8256938001141,160.8256938001141,160.8256938001141,161.32581469998695,,,,,,,,,,,,,,,,,,,,,,,,,AK4,001,2023-03-17_12h01.51.012,Expérimentation1_SOLO,2022.2.5,60.031720779161645,
"Tout comme l’empreinte digitale, le cœur est propre à chaque individu et on peut l’identifier grâce à sa signature cardiaque ",NOMS,"Tout comme l’empreinte digitale, le cœur est propre à chaque individu et on peut l’identifier grâce à sa signature cardiaque ",0,4,4,30,,,,,,,,,,,161.32581469998695,161.32581469998695,161.32581469998695,0.005478000035509467,"Tout comme l'empreinte digitale, le coeur est propre a chaque individu et on peut l'identifier grace à sa signature cardiaque",[0.009259259259259259],[-0.39351851851851855],[1],[0],[0],[19.476654999889433],['Validation_button'],180.80874770018272,180.80874770018272,185.8085551999975,185.8085551999975,185.8085551999975,186.30873000016436,,,,,,,,,,,,,,,,,,,,,,,,,AK4,001,2023-03-17_12h01.51.012,Expérimentation1_SOLO,2022.2.5,60.031720779161645,
Une personne brule plus de calories quand il dort que lorsqu’il regarde la télé  ,ITEMS,Une personne brule plus de calories quand il dort que lorsqu’il regarde la télé  ,0,5,5,20,,,,,,,,,,,186.30873000016436,186.30873000016436,186.30873000016436,0.0043490000534802675,Une personne brule plus de calories quand il dort que lorsq'uil regarde la télé,[-0.004629629629629629],[-0.4009259259259259],[1],[0],[0],[13.528124599950388],['Validation_button'],199.84182600001805,199.84182600001805,204.8419938001316,204.8419938001316,204.8419938001316,205.3417685001623,,,,,,,,,,,,,,,,,,,,,,,,,AK4,001,2023-03-17_12h01.51.012,Expérimentation1_SOLO,2022.2.5,60.031720779161645,
Les élastiques sont plus longs quand ils sont très froids/réfrigérés ,INFOS,Les élastiques sont plus longs quand ils sont très froids/réfrigérés ,0,6,6,11,,,,,,,,,,,205.3417685001623,205.3417685001623,205.3417685001623,0.0050178999081254005,Les élastiques sont plus longs quand ils sont très froids/réfrigérés,[0.01574074074074074],[-0.40555555555555556],[1],[0],[0],[16.126663099974394],['Validation_button'],221.47509409999475,221.47509409999475,226.4748728000559,226.4748728000559,226.4748728000559,226.9750881001819,,,,,,,,,,,,,,,,,,,,,,,,,AK4,001,2023-03-17_12h01.51.012,Expérimentation1_SOLO,2022.2.5,60.031720779161645,
La raie manta peut atteindre 9 mètres de long pour environ 2 tonnes ,INFOS,La raie manta peut atteindre 9 mètres de long pour environ 2 tonnes ,0,7,7,31,,,,,,,,,,,226.9750881001819,226.9750881001819,226.9750881001819,0.004846200114116073,La raie manta peut atteindre 9 metres de long pour environ 2 tonnes,"[-0.05092592592592592, -0.03796296296296296, -0.018518518518518517]","[-0.38425925925925924, -0.40555555555555556, -0.3962962962962963]","[1, 1, 1]","[0, 0, 0]","[0, 0, 0]","[14.260932100005448, 14.910815400071442, 15.344017799943686]",['Validation_button'],242.32474309997633,242.32474309997633,247.32464430015534,247.32464430015534,247.32464430015534,247.82469390006736,,,,,,,,,,,,,,,,,,,,,,,,,AK4,001,2023-03-17_12h01.51.012,Expérimentation1_SOLO,2022.2.5,60.031720779161645,
La plus longue composition classique prendrait 639 ans à être interprétée  ,POINTS,La plus longue composition classique prendrait 639 ans à être interprétée  ,0,8,8,25,,,,,,,,,,,247.82469390006736,247.82469390006736,247.82469390006736,0.005290400004014373,La plus longue composition classique prendrait 639 ans a etre interpretée,"[0.032407407407407406, 0.006481481481481481, -0.010185185185185186, -0.013888888888888888, -0.020370370370370372]","[-0.4064814814814815, -0.38796296296296295, -0.3731481481481482, -0.4212962962962963, -0.40555555555555556]","[1, 1, 1, 1, 1]","[0, 0, 0, 0, 0]","[0, 0, 0, 0, 0]","[14.960364799946547, 15.64345690002665, 16.12669329997152, 16.676709600025788, 16.943391100037843]",['Validation_button'],264.7746051000431,264.7746051000431,269.7746578999795,269.7746578999795,269.7746578999795,270.2745906000491,,,,,,,,,,,,,,,,,,,,,,,,,AK4,001,2023-03-17_12h01.51.012,Expérimentation1_SOLO,2022.2.5,60.031720779161645,
Une vache produit environ 200 000 bouteilles de lait dans sa vie  ,FAITS,Une vache produit environ 200 000 bouteilles de lait dans sa vie  ,0,9,9,2,,,,,,,,,,,270.2745906000491,270.2745906000491,270.2745906000491,0.0036697001196444035,Une vache produit environ 200 000 bouteilles de  lait dans sa vie ,"[-0.03518518518518519, -0.037037037037037035, -0.03333333333333333, -0.03333333333333333, -0.020370370370370372]","[-0.39351851851851855, -0.39444444444444443, -0.3972222222222222, -0.3972222222222222, -0.3925925925925926]","[1, 1, 1, 1, 1]","[0, 0, 0, 0, 0]","[0, 0, 0, 0, 0]","[10.679285800084472, 11.911857299972326, 12.845141200115904, 13.728620300069451, 14.495518800104037]",['Validation_button'],284.7742926001083,284.7742926001083,289.77410390018485,289.77410390018485,289.77410390018485,290.2744683001656,,,,,,,,,,,,,,,,,,,,,,,,,AK4,001,2023-03-17_12h01.51.012,Expérimentation1_SOLO,2022.2.5,60.031720779161645,
Le tsunami dévastateur en Asie s’est produit en décembre 2004 ,FAITS,Le tsunami dévastateur en Asie s’est produit en décembre 2004 ,0,10,10,1,,,,,,,,,,,290.2744683001656,290.2744683001656,290.2744683001656,0.004199400078505278,Le tsunami dévastateur en Asie s'est produit en décembre 2004,[-0.002777777777777778],[-0.3972222222222222],[1],[0],[0],[14.294139700010419],['Validation_button'],304.5741684001405,304.5741684001405,309.5741191999987,309.5741191999987,309.5741191999987,310.07401270000264,,,,,,,,,,,,,,,,,,,,,,,,,AK4,001,2023-03-17_12h01.51.012,Expérimentation1_SOLO,2022.2.5,60.031720779161645,
L’Europe est le seul continent sans désert ,DONNEES,L’Europe est le seul continent sans désert ,0,11,11,8,,,,,,,,,,,310.07401270000264,310.07401270000264,310.07401270000264,0.0024971000384539366,L'Europe est le seul continent sans désert,[0.006481481481481481],[-0.3907407407407407],[1],[0],[0],[12.929523299913853],['Validation_button'],323.00718239997514,323.00718239997514,328.0071380001027,328.0071380001027,328.0071380001027,328.5071928000543,,,,,,,,,,,,,,,,,,,,,,,,,AK4,001,2023-03-17_12h01.51.012,Expérimentation1_SOLO,2022.2.5,60.031720779161645,
Les ongles incarnés sont héréditaires ,DONNEES,Les ongles incarnés sont héréditaires ,0,12,12,7,,,,,,,,,,,328.5071928000543,328.5071928000543,328.5071928000543,0.002595999976620078,Les ongles incarnés sont héréditaires,[0.014814814814814815],[-0.39351851851851855],[1],[0],[0],[7.612817199900746],['Validation_button'],336.12396860006265,336.12396860006265,341.12384730018675,341.12384730018675,341.12384730018675,341.62374940002337,,,,,,,,,,,,,,,,,,,,,,,,,AK4,001,2023-03-17_12h01.51.012,Expérimentation1_SOLO,2022.2.5,60.031720779161645,
La pyramide de Gizé est la seule des 7 merveilles de l’ancien monde qui existe toujours ,ITEMS,La pyramide de Gizé est la seule des 7 merveilles de l’ancien monde qui existe toujours ,0,13,13,22,,,,,,,,,,,341.62374940002337,341.62374940002337,341.62374940002337,0.006858399836346507,La pyramide de Gizé est la seule des 7 merveilles de l'ancien monde qui existe toujours,[-0.011111111111111112],[-0.40370370370370373],[1],[0],[0],[19.125057499855757],['Validation_button'],360.75695600011386,360.75695600011386,365.7568485001102,365.7568485001102,365.7568485001102,366.2569554001093,,,,,,,,,,,,,,,,,,,,,,,,,AK4,001,2023-03-17_12h01.51.012,Expérimentation1_SOLO,2022.2.5,60.031720779161645,
Un attentat terroriste a eu lieu dans les métros Londonien en juillet 2005 ,DONNEES,Un attentat terroriste a eu lieu dans les métros Londonien en juillet 2005 ,0,14,14,5,,,,,,,,,,,366.2569554001093,366.2569554001093,366.2569554001093,0.004712000023573637,Un attentat terroriste a eu lieu dans les métros Londonien en juillet 2005,[-0.012037037037037037],[-0.4],[1],[0],[0],[15.7272638999857],['Validation_button'],381.9900707001798,381.9900707001798,386.989818100119,386.989818100119,386.989818100119,387.4898496000096,,,,,,,,,,,,,,,,,,,,,,,,,AK4,001,2023-03-17_12h01.51.012,Expérimentation1_SOLO,2022.2.5,60.031720779161645,
Les oiseaux bleus ne peuvent pas voir la couleur bleue  ,FAITS,Les oiseaux bleus ne peuvent pas voir la couleur bleue  ,0,15,15,3,,,,,,,,,,,387.4898496000096,387.4898496000096,387.4898496000096,0.0032395999878644943,Les oiseaux bleus ne peuvent pas voir la couleur bleue,[0.016666666666666666],[-0.3972222222222222],[1],[0],[0],[10.995554300025105],['Validation_button'],398.48989380011335,398.48989380011335,403.48968390002847,403.48968390002847,403.48968390002847,403.98975510010496,,,,,,,,,,,,,,,,,,,,,,,,,AK4,001,2023-03-17_12h01.51.012,Expérimentation1_SOLO,2022.2.5,60.031720779161645,
On peut reproduire une clé grâce au son qu’elle émet lorsqu’on l’insère dans une serrure ,POINTS,On peut reproduire une clé grâce au son qu’elle émet lorsqu’on l’insère dans une serrure ,0,16,16,29,,,,,,,,,,,403.98975510010496,403.98975510010496,403.98975510010496,0.004064900102093816,On peut reproduire une clé grace au son qu'elle émet lorsqu'on l'insere dans une serrure,[-0.002777777777777778],[-0.4027777777777778],[1],[0],[0],[15.878008500207216],['Validation_button'],419.87285890011117,419.87285890011117,424.87279010005295,424.87279010005295,424.87279010005295,425.3731146999635,,,,,,,,,,,,,,,,,,,,,,,,,AK4,001,2023-03-17_12h01.51.012,Expérimentation1_SOLO,2022.2.5,60.031720779161645,
L’océan Atlantique est plus salé que l’océan Pacifique,NOMS,L’océan Atlantique est plus salé que l’océan Pacifique,0,17,17,14,,,,,,,,,,,425.3731146999635,425.3731146999635,425.3731146999635,0.003025299869477749,L'océan Atlantique est plus salé que l'océan pacifique,[-0.018518518518518517],[-0.3962962962962963],[1],[0],[0],[10.879232299979776],['Validation_button'],436.2561368001625,436.2561368001625,441.25615629996173,441.25615629996173,441.25615629996173,441.7559867000673,,,,,,,,,,,,,,,,,,,,,,,,,AK4,001,2023-03-17_12h01.51.012,Expérimentation1_SOLO,2022.2.5,60.031720779161645,
L’écriture chinoise comprend plus de 40 000 caractères  ,NOMS,L’écriture chinoise comprend plus de 40 000 caractères  ,0,18,18,18,,,,,,,,,,,441.7559867000673,441.7559867000673,441.7559867000673,0.0025565000250935555,L'écriture chinoise comprend plus de 40 000 caractères,[-0.011111111111111112],[-0.39537037037037037],[1],[0],[0],[11.745352699887007],['Validation_button'],453.50601610005833,453.50601610005833,458.5058667000849,458.5058667000849,458.5058667000849,459.00575889996253,,,,,,,,,,,,,,,,,,,,,,,,,AK4,001,2023-03-17_12h01.51.012,Expérimentation1_SOLO,2022.2.5,60.031720779161645,
L’Himalaya continue de grandir en raison des collisions des plaques tectoniques ,ITEMS,L’Himalaya continue de grandir en raison des collisions des plaques tectoniques ,0,19,19,21,,,,,,,,,,,459.00575889996253,459.00575889996253,459.00575889996253,0.005047499900683761,L'Himalaya continue de grandir en raison des collisions des plaques tectoniques,[0.008333333333333333],[-0.39351851851851855],[1],[0],[0],[17.14306819997728],['Validation_button'],476.15582039998844,476.15582039998844,481.1558456001803,481.1558456001803,481.1558456001803,481.6555833001621,,,,,,,,,,,,,,,,,,,,,,,,,AK4,001,2023-03-17_12h01.51.012,Expérimentation1_SOLO,2022.2.5,60.031720779161645,
L’œil d’une autruche est plus gros que son cerveau  ,ITEMS,L’œil d’une autruche est plus gros que son cerveau  ,0,20,20,19,,,,,,,,,,,481.6555833001621,481.6555833001621,481.6555833001621,0.0037525000516325235,L'oeil d'une autruche est plus gros que son cerveau,[0.0],[-0.4046296296296296],[1],[0],[0],[10.045063899829984],['Validation_button'],491.70542710018344,491.70542710018344,496.70535950013436,496.70535950013436,496.70535950013436,497.20528060011566,,,,,,,,,,,,,,,,,,,,,,,,,AK4,001,2023-03-17_12h01.51.012,Expérimentation1_SOLO,2022.2.5,60.031720779161645,
Les concerts Live 8 ont pris place dans les pays du G8 et en Afrique du Sud en juillet 2005 ,NOMS,Les concerts Live 8 ont pris place dans les pays du G8 et en Afrique du Sud en juillet 2005 ,0,21,21,16,,,,,,,,,,,497.20528060011566,497.20528060011566,497.20528060011566,0.005996099906042218,Les concerts Live 8 ont pris place dans les pays du G8 et en Afrique du Sud en juillet 2005,[-0.006481481481481481],[-0.3972222222222222],[1],[0],[0],[22.54265270009637],['Validation_button'],519.755217900034,519.755217900034,524.7551204001065,524.7551204001065,524.7551204001065,525.2552255000919,,,,,,,,,,,,,,,,,,,,,,,,,AK4,001,2023-03-17_12h01.51.012,Expérimentation1_SOLO,2022.2.5,60.031720779161645,
Les frites sont originaires de France et non de Belgique,INFOS,Les frites sont originaires de France et non de Belgique,0,22,22,12,,,,,,,,,,,525.2552255000919,525.2552255000919,525.2552255000919,0.002756000030785799,"Les frites sonr originaires de France et non de Belgique
",[0.019444444444444445],[-0.3907407407407407],[1],[0],[0],[11.929385900031775],['Validation_button'],537.1883450001478,537.1883450001478,542.1882376000285,542.1882376000285,542.1882376000285,542.688164500054,,,,,,,,,,,,,,,,,,,,,,,,,AK4,001,2023-03-17_12h01.51.012,Expérimentation1_SOLO,2022.2.5,60.031720779161645,
La cacahuète est l’un des ingrédients de la dynamite  ,POINTS,La cacahuète est l’un des ingrédients de la dynamite  ,0,23,23,27,,,,,,,,,,,542.688164500054,542.688164500054,542.688164500054,0.002606000052765012,La cacahuète est l'un des ingrédients de la dynamite,"[-0.027777777777777776, -0.013888888888888888]","[-0.38333333333333336, -0.4009259259259259]","[1, 1]","[0, 0]","[0, 0]","[12.628589400090277, 12.945366200059652]",['Validation_button'],555.6383301999886,555.6383301999886,560.6381157001015,560.6381157001015,560.6381157001015,561.1381276000757,,,,,,,,,,,,,,,,,,,,,,,,,AK4,001,2023-03-17_12h01.51.012,Expérimentation1_SOLO,2022.2.5,60.031720779161645,
La carte de visite d’Al Capone indiquait qu’il était vendeur de meuble d’occasion ,INFOS,La carte de visite d’Al Capone indiquait qu’il était vendeur de meuble d’occasion ,0,24,24,13,,,,,,,,,,,561.1381276000757,561.1381276000757,561.1381276000757,0.003963500028476119,La carte de visite d'Al Capone indiquait qu'il était vendeur de meuble d'occasion,[-0.003703703703703704],[-0.40555555555555556],[1],[0],[0],[17.94413540000096],['Validation_button'],579.0880662000272,579.0880662000272,584.0879927000497,584.0879927000497,584.0879927000497,584.5877788001671,,,,,,,,,,,,,,,,,,,,,,,,,AK4,001,2023-03-17_12h01.51.012,Expérimentation1_SOLO,2022.2.5,60.031720779161645,
Il y a eu 25 présidents Français ,DONNEES,Il y a eu 25 présidents Français ,0,25,25,6,,,,,,,,,,,584.5877788001671,584.5877788001671,584.5877788001671,0.0037485999055206776,Il y a eu 25 présidents Francais,[0.0],[-0.3972222222222222],[1],[0],[0],[12.07804170018062],['Validation_button'],596.6710805001203,596.6710805001203,601.6710131000727,601.6710131000727,601.6710131000727,602.1711172000505,,,,,,,,,,,,,,,,,,,,,,,,,AK4,001,2023-03-17_12h01.51.012,Expérimentation1_SOLO,2022.2.5,60.031720779161645,
Les séparatistes Tchéchènes du Sud de la Russie ont pris en otage une école en septembre 2004 ,POINTS,Les séparatistes Tchéchènes du Sud de la Russie ont pris en otage une école en septembre 2004 ,0,26,26,24,,,,,,,,,,,602.1711172000505,602.1711172000505,602.1711172000505,0.004628799855709076,Les séparatistes Tchéchènes du Sud de la Russie ont pris en otage une école en septembre 2004,[-0.001851851851851852],[-0.39537037037037037],[1],[0],[0],[22.44344750000164],['Validation_button'],624.6208464000374,624.6208464000374,629.62068250007,629.62068250007,629.62068250007,630.12073100009,,,,,,,,,,,,,,,,,,,,,,,,,AK4,001,2023-03-17_12h01.51.012,Expérimentation1_SOLO,2022.2.5,60.031720779161645,
"Seulement 2 pays touchent 3 océans, les Etats-Unis et le Canada",FAITS,"Seulement 2 pays touchent 3 océans, les Etats-Unis et le Canada",0,27,27,4,,,,,,,,,,,630.12073100009,630.12073100009,630.12073100009,0.0038000999484211206,"Seulement 2 pays touchent 3 océans, les Etats unis et le Canada",[0.027777777777777776],[-0.38981481481481484],[1],[0],[0],[19.260784700047225],['Validation_button'],649.3870660001412,649.3870660001412,654.3872790001333,654.3872790001333,654.3872790001333,654.8869927001651,,,,,,,,,,,,,,,,,,,,,,,,,AK4,001,2023-03-17_12h01.51.012,Expérimentation1_SOLO,2022.2.5,60.031720779161645,
Une personne perdra environ 18 kilos de peau durant toute sa vie  ,POINTS,Une personne perdra environ 18 kilos de peau durant toute sa vie  ,0,28,28,26,,,,,,,,,,,654.8869927001651,654.8869927001651,654.8869927001651,0.005934800021350384,Une personne perdra environ 18 kilos de peau durant toute sa vie,"[-0.002777777777777778, 0.008333333333333333]","[-0.38796296296296295, -0.39166666666666666]","[1, 1]","[0, 0]","[0, 0]","[10.942333100130782, 12.892616200027987]",['Validation_button'],667.7871793999802,667.7871793999802,672.7870921001304,672.7870921001304,672.7870921001304,673.2869374000002,,,,,,,,,,,,,,,,,,,,,,,,,AK4,001,2023-03-17_12h01.51.012,Expérimentation1_SOLO,2022.2.5,60.031720779161645,
La Corée du Nord a annoncé avoir conduit un test nucléaire avec succès en octobre 2006  ,ITEMS,La Corée du Nord a annoncé avoir conduit un test nucléaire avec succès en octobre 2006  ,0,29,29,23,,,,,,,,,,,673.2869374000002,673.2869374000002,673.2869374000002,0.003879000199958682,La corée du Nord a annoncé avoir conduit un test nucléaire avec succès en octobre 2006,"[-0.012037037037037037, -0.028703703703703703, -0.017592592592592594]","[-0.412962962962963, -0.3787037037037037, -0.38981481481481484]","[1, 1, 1]","[0, 0, 0]","[0, 0, 0]","[18.42804910009727, 21.094073300017044, 21.97794370003976]",['Validation_button'],695.2702283000108,695.2702283000108,700.2700361001771,700.2700361001771,700.2700361001771,700.7701153000817,,,,,,,,,,,,,,,,,,,,,,,,,AK4,001,2023-03-17_12h01.51.012,Expérimentation1_SOLO,2022.2.5,60.031720779161645,
Il y a en moyenne 178 graines de sésames sur le pain du Big Mac de McDonald  ,NOMS,Il y a en moyenne 178 graines de sésames sur le pain du Big Mac de McDonald  ,0,30,30,17,,,,,,,,,,,700.7701153000817,700.7701153000817,700.7701153000817,0.0036295000463724136,Il y a en moyenne 178 graines de sésames sur le pain du Big Mac de McDonald,"[-0.004629629629629629, -0.001851851851851852]","[-0.38333333333333336, -0.3972222222222222]","[1, 1]","[0, 0]","[0, 0]","[17.71069970005192, 19.31072650011629]",['Validation_button'],720.0866319001652,720.0866319001652,725.0863936000969,725.0863936000969,725.0863936000969,725.5863985000178,,,,,,,,,,,,,,,,,,,,,,,,,AK4,001,2023-03-17_12h01.51.012,Expérimentation1_SOLO,2022.2.5,60.031720779161645,
L’indicatif téléphonique international de l’Antarctique est 672 ,INFOS,L’indicatif téléphonique international de l’Antarctique est 672 ,0,31,31,10,,,,,,,,,,,725.5863985000178,725.5863985000178,725.5863985000178,0.0035224000457674265,L'indicatif téléphonique international de l'Antartique est 672,[-0.002777777777777778],[-0.40185185185185185],[1],[0],[0],[18.39439329993911],['Validation_button'],743.9861509001348,743.9861509001348,748.9862929000519,748.9862929000519,748.9862929000519,749.4859625999816,,,,,,,,,,,,,,,,,,,,,,,,,AK4,001,2023-03-17_12h01.51.012,Expérimentation1_SOLO,2022.2.5,60.031720779161645,
,,,,,,,,,,,,,,,,,,,,,,,,,,,,,,,,,,,749.4859625999816,752.4862061000895,i,655.671316599939,,,,,,,,,,,,,,,,,,,,,AK4,001,2023-03-17_12h01.51.012,Expérimentation1_SOLO,2022.2.5,60.031720779161645,
,,,,,,,,,,,,,,,,,,,,,,,,,,,,,,,,,,,,,,,1408.179456999991,1408.6793848001398,1408.6793848001398,1411.6626189001836,space,6.453222700161859,,,,,,,,,,,,,,,AK4,001,2023-03-17_12h01.51.012,Expérimentation1_SOLO,2022.2.5,60.031720779161645,
L’indicatif téléphonique international de l’Antarctique est 672 ,INFOS,L’indicatif téléphonique international de l’Antarctique est 672 ,,,,,0,0,0,10,,,,,,,,,,,,,,,,,,,,,,,,,,,,,1430.245754700154,1430.746002000058,,,,,1418.7127760001458,1418.7127760001458,1418.7127760001458,0.06928590009920299,"Point
",[-0.025],[-0.3962962962962963],[1],[0],[0],[11.531216700095683],['validation_reco'],,,AK4,001,2023-03-17_12h01.51.012,Expérimentation1_SOLO,2022.2.5,60.031720779161645,
La carte de visite d’Al Capone indiquait qu’il était vendeur de meuble d’occasion ,INFOS,La carte de visite d’Al Capone indiquait qu’il était vendeur de meuble d’occasion ,,,,,0,1,1,13,,,,,,,,,,,,,,,,,,,,,,,,,,,,,1446.6121337001678,1447.1121863001026,,,,,1430.746002000058,1430.746002000058,1430.746002000058,0.003469400107860565,Nom,[-0.017592592592592594],[-0.38981481481481484],[1],[0],[0],[15.861406699987128],['validation_reco'],,,AK4,001,2023-03-17_12h01.51.012,Expérimentation1_SOLO,2022.2.5,60.031720779161645,
On peut reproduire une clé grâce au son qu’elle émet lorsqu’on l’insère dans une serrure ,POINTS,On peut reproduire une clé grâce au son qu’elle émet lorsqu’on l’insère dans une serrure ,,,,,0,2,2,29,,,,,,,,,,,,,,,,,,,,,,,,,,,,,1451.779019500129,1452.2790475999936,,,,,1447.1121863001026,1447.1121863001026,1447.1121863001026,0.0042779999785125256,,"[-0.02962962962962963, -0.021296296296296296]","[-0.38055555555555554, -0.3888888888888889]","[1, 1]","[0, 0]","[0, 0]","[4.227916799951345, 4.6613765000365674]",['validation_reco'],,,AK4,001,2023-03-17_12h01.51.012,Expérimentation1_SOLO,2022.2.5,60.031720779161645,
Une personne perdra environ 18 kilos de peau durant toute sa vie  ,POINTS,Une personne perdra environ 18 kilos de peau durant toute sa vie  ,,,,,0,3,3,26,,,,,,,,,,,,,,,,,,,,,,,,,,,,,1463.6787140001543,1464.178601300111,,,,,1452.2790475999936,1452.2790475999936,1452.2790475999936,0.0030799000523984432,Point,[-0.025],[-0.3990740740740741],[1],[0],[0],[11.395889499923214],['validation_reco'],,,AK4,001,2023-03-17_12h01.51.012,Expérimentation1_SOLO,2022.2.5,60.031720779161645,
